{
  "schema_id": "handbook.internal-dispatch",
  "schema_version": "1.4",
  "dispatch_id": "20260803T001500Z--HCM-3-2--fresh-selector-supplemental-2",
  "created_at_utc": "2026-08-03T00:15:00Z",
  "source_handoff_ids": ["20260801T141509Z--HCM-3-1--orchestration--vocabulary-resolution-completed", "20260802T012613Z--HCM-3-2--orchestration--authority-lineage-composition-required"],
  "parent_orchestration_id": "20260802T232751Z--HCM-3-2--context-resolution-kernel-fresh",
  "orchestration_decision": "proof_or_review_followup",
  "execution_target": "internal_subagent",
  "agent_type": "default",
  "role": "review",
  "fresh_context_required": true,
  "closeout_owner": "parent_orchestrator",
  "required_skills": ["using-agent-skills", "context-engineering", "spec-driven-development", "planning-and-task-breakdown", "doubt-driven-development", "documentation-and-ADRs", "api-and-interface-design", "security-and-hardening", "code-review-and-quality"],
  "phase_id": "HCM-3",
  "slice_id": "HCM-3.2",
  "packet_id": "HCM-3.2-FRESH-P1-selector-authority",
  "subject_fingerprint": "sha256:dea09f62e2572ebf4aeaf53d787e9d462d602129d85cc29e3aa5081c7fe4bd2a",
  "review_cycle": {"kind": "supplemental_causal", "cycle_id": "hcm-3.2-fresh-selector-supplemental-2", "trigger_run_ids": ["hcm32_selector_supp1"], "finding_refs": ["HCM32-FRESH-SEL-CLOS-001"]},
  "causal_outcome_registry": {
    "declared_at_utc": "2026-08-02T23:27:51Z",
    "algorithm": "sha256",
    "encoding": "canonical-json-newline-v1",
    "outcomes": [{"integrated_outcome_id": "hcm-3.2-context-resolution-kernel-fresh-whole-slice", "packet_ids": ["HCM-3.2-FRESH-P1-selector-authority", "HCM-3.2-FRESH-P2-kernel-implementation", "HCM-3.2-FRESH-P3-proof", "HCM-3.2-FRESH-P4-final-closeout"], "authority_ref": "docs/specs/handbook-contract-membrane/slices/HCM-3.2/decision/2026-08-01-context-resolution-kernel-selector.md"}],
    "fingerprint": "sha256:c45bc9bc7bfee52e23bc87514c5facf9c1c769d6dc777d784c48339f9a8f793b"
  },
  "causal_control": {
    "causal_budget_id": "sha256:91f15b60a9ab3ae9850f346d6045d076a46f2bcc2fda9fcc0ea5ecbccc932228",
    "integrated_outcome_id": "hcm-3.2-context-resolution-kernel-fresh-whole-slice",
    "outcome_registry_fingerprint": "sha256:c45bc9bc7bfee52e23bc87514c5facf9c1c769d6dc777d784c48339f9a8f793b",
    "review_stage": "planning",
    "stage_transition": {"kind": "continue", "from_stage": "planning"},
    "event_reason": "reviewer_finding",
    "causal_predecessor_dispatch_id": "20260803T000500Z--HCM-3-2--fresh-selector-supplemental-1"
  },
  "pre_review_convergence": {
    "gate_id": "hcm-3.2-fresh-selector-supplemental-2-convergence",
    "completed_at_utc": "2026-08-03T00:14:59Z",
    "checks": [
      {"kind": "complete_packet_wall", "status": "passed", "command": "repair only the borrowed-versus-owned candidate defect", "evidence_ref": "existing candidate accessor now consumes error and returns owned sealed candidate; no new name"},
      {"kind": "recursive_fixture_consumer_inventory", "status": "passed", "command": "trace failed resolution error through consuming accessor into request constructor", "evidence_ref": "owned move is now mechanically implementable without field exposure or clone"},
      {"kind": "manifest_replay", "status": "passed", "command": "recompute sorted five-entry subject", "evidence_ref": "aggregate sha256:dea09f62e2572ebf4aeaf53d787e9d462d602129d85cc29e3aa5081c7fe4bd2a"},
      {"kind": "formatting", "status": "passed", "command": "strict UTF-8 and fence balance", "evidence_ref": "passed"},
      {"kind": "whitespace", "status": "passed", "command": "git diff --check", "evidence_ref": "passed"}
    ]
  },
  "ancillary_allowance": {"kind": "none", "risk_ceiling": "no_ancillary_surface", "baseline_ref": null, "max_paths": 0, "max_changed_lines": 0, "entries": []},
  "subject_hygiene": {"whitespace_policy": "text-files-no-trailing-whitespace-v1"},
  "subject_manifest": {
    "algorithm": "sha256",
    "encoding": "repo-path-null-sha256-newline-v1",
    "entries": [
      {"path": "docs/specs/handbook-contract-membrane/slices/HCM-3.2/SPEC.md", "sha256": "bf1c5df74f26698ff8fdd6cb78e51ada9b8d3a45163cce311bff982023703f35"},
      {"path": "docs/specs/handbook-contract-membrane/slices/HCM-3.2/decision/2026-08-01-context-resolution-kernel-selector.md", "sha256": "7e983f00376c4aefea5cb371957b459a3af10921c75c6710b5263361736b6507"},
      {"path": "docs/specs/handbook-contract-membrane/slices/HCM-3.2/proof/implementation/20260802T234000Z--fresh-selector-discovery-remediation.md", "sha256": "046866930b34818c16322f554813d82708d22e4144e22a4af9bc52e882e6f2f2"},
      {"path": "docs/specs/handbook-contract-membrane/slices/HCM-3.2/tasks/plan.md", "sha256": "8b63c96fe25edadba8593c73809da22af841334825ed873ac99568eac4837fca"},
      {"path": "docs/specs/handbook-contract-membrane/slices/HCM-3.2/tasks/todo.md", "sha256": "248a5c054180b1d7323cbefc5b45fd261b3713b78e9f79a4571de16022594542"}
    ],
    "aggregate_fingerprint": "sha256:dea09f62e2572ebf4aeaf53d787e9d462d602129d85cc29e3aa5081c7fe4bd2a"
  },
  "active_resolution": {"level": "HCM-3.2 final planning supplemental closure", "scope_horizon": "only HCM32-FRESH-SEL-CLOS-001", "detail_resolution": "ownership transfer of sealed failed-resolution candidate", "temporal_horizon": "second and final supplemental before RED/Rust", "authority_horizon": "unchanged HCM-3.2 fresh selector", "memory_horizon": "prior cycle result and amended exact subject", "validation_horizon": "terminal CLEAN or non-completed stop"},
  "authority_refs": [{"path": "docs/specs/handbook-contract-membrane/slices/HCM-3.2/decision/2026-08-01-context-resolution-kernel-selector.md", "sections": ["Exact public symbols and signatures"]}, {"path": "docs/specs/handbook-contract-membrane/slices/HCM-3.2/proof/implementation/20260802T234000Z--fresh-selector-discovery-remediation.md", "sections": ["HCM-3.2 Fresh Selector Discovery Remediation"]}],
  "repo_truth": "First supplemental closed all items except the borrowed candidate accessor. The amended accessor consumes the error and returns the owned candidate. No tests or Rust edits exist.",
  "allowed_scope": ["Review only HCM32-FRESH-SEL-CLOS-001.", "Verify the exact accessor and request signatures permit an owned sealed candidate flow.", "Return CLEAN only if that finding closes with no directly causal P1/P2."],
  "non_goals": ["No general discovery.", "No edits, tests, Rust, writes, staging, commits, delegation, or scope widening."],
  "tasks": ["Disposition the one cited finding with exact evidence.", "Return CLEAN if closed; otherwise report only a directly causal P1/P2."],
  "contracts_and_gates": ["This is the second and final supplemental causal cycle.", "No cycle follows CLEAN and no further planning cycle is available.", "RED/Rust remain forbidden until CLEAN."],
  "stop_conditions": ["Return FINDINGS if incomplete; the parent must then stop non-completed.", "Return BLOCKED for scope beyond authority."],
  "return_contract": {"transport": "built_in_subagent", "findings_first": true, "include_agent_identity_and_status": true, "edit_scope": "read_only", "global_handoff": "forbidden", "ledger_write": "forbidden", "user_task_hop": "forbidden", "required_result_fields": ["agent_id", "final_status", "verdict", "findings", "advisory_disposition", "validation", "parent_disposition"]}
}
